{"quality_score_report_id":"score_fixture","version_number":1,"total_score":82,"dimensions":[{"dimension":"原著忠实度","score":82,"weight":0.1,"evidence":[{"source_span_id":"span_fixture"}],"issues":[{"severity":"info","location":{"scope":"season"},"evidence":"账册出现","message":"已复核","suggestion":"保持来源 span"}]},{"dimension":"因果完整性","score":82,"weight":0.1,"evidence":[{"source_span_id":"span_fixture"}],"issues":[{"severity":"info","location":{"scope":"season"},"evidence":"因果","message":"已复核","suggestion":"保持因果"}]},{"dimension":"人物一致性","score":82,"weight":0.1,"evidence":[{"source_span_id":"span_fixture"}],"issues":[{"severity":"info","location":{"scope":"season"},"evidence":"目标","message":"已复核","suggestion":"保持目标"}]},{"dimension":"钩子强度","score":82,"weight":0.1,"evidence":[{"source_span_id":"span_fixture"}],"issues":[{"severity":"info","location":{"scope":"season"},"evidence":"门响","message":"已复核","suggestion":"保持悬念"}]},{"dimension":"节奏密度","score":82,"weight":0.1,"evidence":[{"source_span_id":"span_fixture"}],"issues":[{"severity":"info","location":{"scope":"season"},"evidence":"节拍","message":"已复核","suggestion":"保持密度"}]},{"dimension":"对白自然度","score":82,"weight":0.1,"evidence":[{"source_span_id":"span_fixture"}],"issues":[{"severity":"info","location":{"scope":"season"},"evidence":"对白","message":"已复核","suggestion":"保持口语"}]},{"dimension":"视觉可执行性","score":82,"weight":0.1,"evidence":[{"source_span_id":"span_fixture"}],"issues":[{"severity":"info","location":{"scope":"season"},"evidence":"动作","message":"已复核","suggestion":"保持动作"}]},{"dimension":"连续性","score":82,"weight":0.1,"evidence":[{"source_span_id":"span_fixture"}],"issues":[{"severity":"info","location":{"scope":"season"},"evidence":"道具","message":"已复核","suggestion":"保持连续"}]},{"dimension":"情绪传达","score":82,"weight":0.1,"evidence":[{"source_span_id":"span_fixture"}],"issues":[{"severity":"info","location":{"scope":"season"},"evidence":"反应","message":"已复核","suggestion":"保持反应"}]},{"dimension":"声画可执行性","score":82,"weight":0.1,"evidence":[{"source_span_id":"span_fixture"}],"issues":[{"severity":"info","location":{"scope":"season"},"evidence":"声音","message":"已复核","suggestion":"保持声源"}]}]}
